{"schema":"repository-harness-payload-index/v1","trust_domain":"repository-harness-core","role":"core-release","sequence":42,"release":"1.0.0-test.1","source_commit":"1111111111111111111111111111111111111111","tag":"harness-v1-core-v1.0.0-test.1","assets":[{"id":"decision-template","source":"docs/templates/decision.md","sha256":"e92ba7a5b7bc10ce6c213af75a191619fc305c3945cdd55d4dc6bac72dcd42c1","bytes":331,"disposition":"managed-v1","destination":"docs/templates/decision.md"},{"id":"story-template","source":"docs/templates/story.md","sha256":"8a5a7796582d251375a027e019c02e6eb2855b9f19769309374111a525e10b30","bytes":807,"disposition":"optional-v1","destination":"docs/templates/story.md"}]}